,STATION_NUMBER,Evaluation_Year,RHBN-N,DATA_TYPE,Yield,Ecoregion,Data.Quality,Years.C,Years.S,Watershed.Quality,Percent_Human.Impact,Percent.Urban,Road.Density,Pop.Density,Flow.Structures,Reservoir.Pct,GRanD,Latitude,Longitude,Years_start,Years_end,Station_name,Province
345,05BB001,2020,1,Q,560,Northwest Forested Mountains,C,106,,1,0.018,0.018,0.16,35,3,0,,51.1722,-115.572,1909,2018, BOW RIVER AT BANFF, AB
870,08NA002,2020,0,Q,510,Northwest Forested Mountains,C,97,13,1,0.11,0.11,0.17,2,2,0,,51.2436,-116.913,1903,2018, COLUMBIA RIVER AT NICHOLSON, BC
801,08JE001,2020,1,Q,290,Northwest Forested Mountains,C,72,9,1,0.0081,0.0081,0.024,1,0,0,,54.4169,-124.271,1929,2018, STUART RIVER NEAR FORT ST. JAMES, BC
857,08MG005,2020,1,Q,1900,Marine West Coast Forests,C,89,7,1,0,0,0.056,1,0,0,,50.336,-122.8,1914,2017, LILLOOET RIVER NEAR PEMBERTON, BC
910,08NL007,2020,1,Q,410,Northwest Forested Mountains,C,73,3,1,0.092,0.092,0,71,2,0.031,,49.4597,-120.504,1914,2017, SIMILKAMEEN RIVER AT PRINCETON, BC
,08MH001,2020,1,Q,1700,Northwest Forested Mountains,C,79,3,1,0.034,0.034,0,71,0,0,,49.0974,-121.967,1911,2017, CHILLIWACK RIVER AT VEDDER CROSSING,BC